Set value for particular cell in pandas DataFrame	df['x']['C'] = 10
Norm along row in pandas	np.sqrt(np.square(df).sum(axis=1))
How do I remove identical items from a list and sort it in Python?	sorted(set(my_list))
Python Finding Index of Maximum in List	max(enumerate(a), key=lambda x: x[1])[0]
Python Accessing Values in A List of Dictionaries	[d['Name'] for d in thisismylist]
Python Accessing Values in A List of Dictionaries	[(d['Name'], d['Age']) for d in thisismylist]
How to grab one random item from a database in Django/postgreSQL?	model.objects.all().order_by('?')[0]
Run a python script from another python script, passing in args	os.system('script2.py 1')
Python Regex for hyphenated words	re.findall('\\w+(?:-\\w+)+', text)
Create variable key/value pairs with argparse (python)	parser.add_argument('--conf', nargs=2, action='append')
"How do you pick ""x"" number of unique numbers from a list in Python?"	random.sample(list(range(1, 16)), 3)
Sort a list of strings based on regular expression match or something similar	strings.sort(key=lambda str: re.sub('.*%(.).*', '\\1', str))
Sort a list of strings based on regular expression match or something similar	strings.sort(key=lambda str: re.sub('.*%', '', str))
Appending to 2D lists in Python	listy = [[] for i in range(3)]
Sort NumPy float array column by column	A = np.array(sorted(A, key=tuple))
Python list comprehension for loops	[(x + y) for x in '12345' for y in 'ab']
Trimming a string	' Hello '.strip()
Trimming a string	myString.strip()
Trimming a string	' Hello '.strip()
Trimming a string	' Hello'.strip()
Trimming a string	'Bob has a cat'.strip()
Trimming a string	'<tab><tab>  Hello<tab><tab>'.strip()
Trimming a string	str.strip()
Trimming a string	myString.strip('\n')
Trimming a string	myString.lstrip('\n\r')
Trimming a string	myString.rstrip('\n\t')
Trimming a string	'  Hello\n'.strip(' ')
Sort a list of tuples depending on two elements	sorted(unsorted, key=lambda element: (element[1], element[2]))
Python, Encoding output to UTF-8	print(content.decode('utf8'))
How do I vectorize this loop in numpy?	np.ma.array(np.tile(arr, 2).reshape(2, 3), mask=~cond).argmax(axis=1)
How to convert efficiently a dataframe column of string type into datetime in Python?	pd.to_datetime(df.ID.str[1:-3])
How to gracefully fallback to `NaN` value while reading integers from a CSV with Pandas?	df = pd.read_csv('my.csv', dtype={'my_column': np.float64}, na_values=['n/a'])
How to gracefully fallback to `NaN` value while reading integers from a CSV with Pandas?	df = pd.read_csv('my.csv', na_values=['n/a'])
All combinations of a list of lists	list(itertools.product(*a))
How to extract all UPPER from a string? Python	re.sub('[^A-Z]', '', s)
Get date from ISO week number in Python	datetime.strptime('2011221', '%Y%W%w')
"How to read a ""C source, ISO-8859 text"""	codecs.open('myfile', 'r', 'iso-8859-1').read()
List Comprehensions in Python : efficient selection in a list	[f(x) for x in list]
Regex matching 5-digit substrings not enclosed with digits	re.findall('(?<!\\d)\\d{5}(?!\\d)', s)
filtering elements from list of lists in Python?	[item for item in a if sum(item) > 10]
python: how to convert currency to decimal?	cents_int = int(round(float(dollars.strip('$')) * 100))
Remove final characters from string recursively - What's the best way to do this?	""""""""""""".join(dropwhile(lambda x: x in bad_chars, example_line[::-1]))[::-1]"
Creating an empty list	l = []
Creating an empty list	l = list()
Creating an empty list	list()
Creating an empty list	[]
How to properly quit a program in python	sys.exit(0)
Add string in a certain position in Python	s[:4] + '-' + s[4:]
Python : how to append new elements in a list of list?	[[] for i in range(3)]
Python : how to append new elements in a list of list?	a = [[] for i in range(3)]
Changing the referrer URL in python requests	requests.get(url, headers={'referer': my_referer})
Python, Matplotlib, subplot: How to set the axis range?	pylab.ylim([0, 1000])
Pandas convert a column of list to dummies	pd.get_dummies(s.apply(pd.Series).stack()).sum(level=0)
Finding the largest delta between two integers in a list in python	max(abs(x - y) for x, y in zip(values[1:], values[:-1]))
How to convert hex string to integer in Python?	y = str(int(x, 16))
check if a string is a number (float)	a.isdigit()
check if a string is a number	isdigit()
check if a string is a number	b.isdigit()
pandas.read_csv: how to skip comment lines	pd.read_csv(StringIO(s), sep=',', comment='#')
Pandas: how to change all the values of a column?	df['Date'] = df['Date'].apply(lambda x: int(str(x)[-4:]))
sum a list of numbers in Python	sum(list_of_nums)
how to get the index of dictionary with the highest value in a list of dictionary	max(lst, key=lambda x: x['score'])
Get data from the meta tags using BeautifulSoup	soup.findAll(attrs={'name': 'description'})
Python: how to get rid of spaces in str(dict)?	str({'a': 1, 'b': 'as df'}).replace(': ', ':').replace(', ', ',')
Python: how to get rid of spaces in str(dict)?	'{' + ','.join('{0!r}:{1!r}'.format(*x) for x in list(dct.items())) + '}'
Python- insert a character into a string	""""""""""""".join(parts[1:])"
Python- insert a character into a string	""""""",+"""""".join(c.rsplit('+', 1))"
How do I delete a row in a numpy array which contains a zero?	a[np.all(a != 0, axis=1)]
Extracting only characters from a string in Python	""""""" """""".join(re.split('[^a-zA-Z]*', 'your string'))"
Extracting only characters from a string in Python	re.split('[^a-zA-Z]*', 'your string')
Create Union of All Values Contained in Multiple Lists	results_union = set().union(*results_list)
Create Union of All Values Contained in Multiple Lists	return list(set(itertools.chain(*result_list)))
python: check if an numpy array contains any element of another array	np.any(np.in1d(a1, a2))
Removing control characters from a string in python	return ''.join(ch for ch in s if unicodedata.category(ch)[0] != 'C')
How to compare two lists in python	all(i < j for i, j in zip(a, b))
python selenium click on button	driver.find_element_by_css_selector('.button.c_button.s_button').click()
python selenium click on button	driver.find_element_by_css_selector('.button .c_button .s_button').click()
Is it possible to kill a process on Windows from within Python?	os.system('taskkill /im make.exe')
How to get current date and time from DB using SQLAlchemy	print(select([my_table, func.current_date()]).execute())
Remove duplicate chars using regex?	re.sub('([a-z])\\1+', '\\1', 'ffffffbbbbbbbqqq')
Regex to remove periods in acronyms?	re.sub('(?<!\\w)([A-Z])\\.', '\\1', s)
how to parse a list or string into chunks of fixed length	split_list = [the_list[i:i + n] for i in range(0, len(the_list), n)]
replacing all regex matches in single line	re.sub('\\b(this|string)\\b', '<markup>\\1</markup>', 'this is my string')
Output data from all columns in a dataframe in pandas	pandas.set_option('display.max_columns', 7)
Output data from all columns in a dataframe in pandas	pandas.set_option('display.max_columns', None)
Modifying a subset of rows in a pandas dataframe	df.ix[df.A == 0, 'B'] = np.nan
Selecting Element followed by text with Selenium WebDriver	"driver.find_element_by_xpath(""//li/label/input[contains(..,'polishpottery')]"")"
Ordering a list of dictionaries in python	mylist.sort(key=operator.itemgetter('weight', 'factor'))
Ordering a list of dictionaries in python	mylist.sort(key=lambda d: (d['weight'], d['factor']))
From a list of lists to a dictionary	{x[1]: x for x in lol}
Sorting dictionary keys based on their values	sorted(d, key=lambda k: d[k][1])
Python: How to round 123 to 100 instead of 100.0?	int(round(123, -2))
How do I create a file in python without overwriting an existing file	fd = os.open('x', os.O_WRONLY | os.O_CREAT | os.O_EXCL)
How to slice a list of strings with space delimiter?	new_list = [x.split()[-1] for x in Original_List]
Reverse a string	'hello world'[::(-1)]
Reverse a string	s[::(-1)]
Reverse a string	''.join(reversed('foo'))
Reverse a string	''.join(reversed(string))
Reverse a string	'foo'[::(-1)]
Reverse a string	a_string[::(-1)]
Reverse a string	def reversed_string(a_string):<nl><tab>return a_string[::(-1)]
Reverse a string	''.join(reversed(s))
Generate a sequence of numbers in Python	""""""","""""".join(str(i) for i in range(100) if i % 4 in (1, 2))"
How to convert this list into a dictionary	dict([(e[0], int(e[1])) for e in lst])
sorting a list of tuples in Python	sorted(list_of_tuples, key=lambda tup: tup[::-1])
sorting a list of tuples in Python	sorted(list_of_tuples, key=lambda tup: tup[1])
Concatenating two one-dimensional NumPy arrays	numpy.concatenate([a, b])
Writing a list to a file with Python	for item in thelist:<nl><tab>thefile.write(('%s\n' % item))
Writing a list to a file with Python	for item in thelist:<nl><tab>pass
Writing a list to a file with Python	pickle.dump(itemlist, outfile)
Writing a list to a file with Python	outfile.write('\n'.join(itemlist))
SQLAlchemy: a better way for update with declarative?	session.query(User).filter_by(id=123).update({'name': 'Bob Marley'})
How to send cookies in a post request with the Python Requests library?	r = requests.post('http://wikipedia.org', cookies=cookie)
How to include third party Python libraries in Google App Engine?	sys.path.insert(0, 'libs')
get current time	datetime.datetime.now()
get current time	datetime.datetime.now().time()
get current time	strftime('%Y-%m-%d %H:%M:%S', gmtime())
get current time	str(datetime.now())
get current time	datetime.datetime.time(datetime.datetime.now())
Converting hex to int in python	ord('\xff')
Python Pandas Identify Duplicated rows with Additional Column	df.groupby(['PplNum', 'RoomNum']).cumcount() + 1
How to get UTC time in Python?	datetime.utcnow()
Python: Make last item of array become the first	a[-1:] + a[:-1]
pandas: how to run a pivot with a multi-index?	df.set_index(['year', 'month', 'item']).unstack(level=-1)
pandas: how to run a pivot with a multi-index?	df.pivot_table(values='value', index=['year', 'month'], columns='item')
How to print/show an expression in rational number form in python	print('\n\x1b[4m' + '3' + '\x1b[0m' + '\n2')
What is the best way to sort list with custom sorting parameters in Python?	li1.sort(key=lambda x: not x.startswith('b.'))
How to loop backwards in python?	range(10, 0, -1)
Get Element value with minidom with Python	name[0].firstChild.nodeValue
Simple threading in Python 2.6 using thread.start_new_thread()	thread.start_new_thread(myfunction, ('MyStringHere', 1))
Simple threading in Python 2.6 using thread.start_new_thread()	thread.start_new_thread(myfunction, ('MyStringHere', 1))
How to find all positions of the maximum value in a list?	a.index(max(a))
Regex add character to matched string	re.sub('\\.(?=[^ .])', '. ', para)
how to turn a string of letters embedded in squared brackets into embedded lists	[i.split() for i in re.findall('\\[([^\\[\\]]+)\\]', a)]
extract item from list of dictionaries	[d for d in a if d['name'] == 'pluto']
extract item from list of dictionaries	[d for d in a if d['name'] == 'pluto']
Python: simplest way to get list of values from dict?	list(d.values())
String manipulation in Cython	re.sub(' +', ' ', s)
Set execute bit for a file using python	os.chmod('my_script.sh', 484)
Pandas to_csv call is prepending a comma	df.to_csv('c:\\data\\t.csv', index=False)
Python regex to remove all words which contains number	re.sub('\\w*\\d\\w*', '', words).strip()
How can I control the keyboard and mouse with Python?	dogtail.rawinput.click(100, 100)
How to parse dates with -0400 timezone string in python?	datetime.strptime('2009/05/13 19:19:30 -0400', '%Y/%m/%d %H:%M:%S %z')
Python - Locating the position of a regex match in a string?	re.search('\\bis\\b', String).start()
Python - Locating the position of a regex match in a string?	re.search('is', String).start()
How to input an integer tuple from user?	tuple(map(int, input().split(',')))
How to input an integer tuple from user?	tuple(int(x.strip()) for x in input().split(','))
How to replace unicode characters in string with something else python?	str.decode('utf-8').replace('\u2022', '*').encode('utf-8')
How to replace unicode characters in string with something else python?	str.decode('utf-8').replace('\u2022', '*')
How to convert ndarray to array?	np.zeros((3, 3)).ravel()
What OS am I running on	import platform<nl>platform.system()
What OS am I running on	import platform<nl>platform.release()
What OS am I running on	print(os.name)
What is the most pythonic way to exclude elements of a list that start with a specific character?	[x for x in my_list if not x.startswith('#')]
"Python string formatting when string contains ""%s"" without escaping"	"""""""Day old bread, 50% sale {0}"""""".format('today')"
List of Tuples (string, float)with NaN How to get the min value?	min(list, key=lambda x: float('inf') if math.isnan(x[1]) else x[1])
Python: Finding average of a nested list	a = [(sum(x) / len(x)) for x in zip(*a)]
How do I add custom field to Python log format string?	logging.info('Log message', extra={'app_name': 'myapp'})
finding non-numeric rows in dataframe in pandas?	df.applymap(lambda x: isinstance(x, (int, float)))
Sort list of mixed strings based on digits	sorted(l, key=lambda x: int(re.search('\\d+', x).group(0)))
Function to close the window in Tkinter	self.root.destroy()
Calcuate mean for selected rows for selected columns in pandas data frame	df.iloc[:, ([2, 5, 6, 7, 8])].mean(axis=1)
How to filter by sub-level index in Pandas	df[df.index.map(lambda x: x[1].endswith('0630'))]
Deleting row with Flask-SQLAlchemy	db.session.delete(page)
How do I convert a unicode to a string at the Python level?	""""""""""""".join(chr(ord(c)) for c in 'Andr\xc3\xa9')"
How do I convert a unicode to a string at the Python level?	""""""""""""".join(chr(ord(c)) for c in 'Andr\xc3\xa9').decode('utf8')"
Directory listing	for (dirname, dirnames, filenames) in os.walk('.'):<nl><tab>for subdirname in dirnames:<nl><tab><tab>print(os.path.join(dirname, subdirname))<nl><tab>for filename in filenames:<nl><tab><tab>pass
Directory listing	os.listdir(path)
How to rename all folders?	os.rename(dir, dir + '!')
Pythonic way to insert every 2 elements in a string	"""""""-"""""".join(a + b for a, b in zip(s[::2], s[1::2]))"
Printing numbers in python	print('%.3f' % 3.1415)
Add element to a json in python	data[0]['f'] = var
Retrieving python module path	print(a_module.__file__)
Retrieving python module path	print(os.getcwd())
Retrieving python module path	path = os.path.abspath(amodule.__file__)
Padding a list in python with particular value	self.myList.extend([0] * (4 - len(self.myList)))
Fastest Way to Drop Duplicated Index in a Pandas DataFrame	df[~df.index.duplicated()]
Is there a more pythonic way of exploding a list over a function's arguments?	foo(*i)
Generate list of numbers in specific format	[('%.2d' % i) for i in range(16)]
Summarizing a dictionary of arrays in Python	sorted(iter(mydict.items()), key=lambda tup: sum(tup[1]), reverse=True)[:3]
Summarizing a dictionary of arrays in Python	heapq.nlargest(3, iter(mydict.items()), key=lambda tup: sum(tup[1]))
get index of character in python list	['a', 'b'].index('b')
How to set font size of Matplotlib axis Legend?	plt.setp(legend.get_title(), fontsize='xx-small')
Python: Convert a string to an integer	int('  23  ')
How to extract the n-th elements from a list of tuples in python?	[x[1] for x in elements]
getting the opposite diagonal of a numpy array	np.diag(np.rot90(array))
Convert list of tuples to list?	list(chain.from_iterable(a))
Removing white space from txt with python	re.sub('\\s{2,}', '|', line.strip())
Limiting floats to two decimal points	print(('%.2f' % a))
Limiting floats to two decimal points	print(('{0:.2f}'.format(a)))
Limiting floats to two decimal points	print(('{0:.2f}'.format(round(a, 2))))
Limiting floats to two decimal points	print(('%.2f' % round(a, 2)))
Limiting floats to two decimal points	('%.2f' % 13.9499999)
Limiting floats to two decimal points	('%.2f' % 3.14159)
Limiting floats to two decimal points	float('{0:.2f}'.format(13.95))
Limiting floats to two decimal points	'{0:.2f}'.format(13.95)
How to I load a tsv file into a Pandas DataFrame?	DataFrame.from_csv('c:/~/trainSetRel3.txt', sep='\t')
How to set UTC offset for datetime?	dateutil.parser.parse('2013/09/11 00:17 +0900')
Passing list of parameters to SQL in psycopg2	cur.mogrify('SELECT * FROM table WHERE column IN %s;', ((1, 2, 3),))
How would I sum a multi-dimensional array in the most succinct python?	sum([sum(x) for x in [[1, 2, 3, 4], [2, 4, 5, 6]]])
Access an arbitrary element in a dictionary in Python	next(iter(dict.values()))
Access an arbitrary element in a dictionary in Python	next(iter(list(dict.values())))
Pandas: aggregate based on filter on another column	df.groupby(['Month', 'Fruit']).sum().unstack(level=0)
sorting list of tuples by arbitrary key	sorted(mylist, key=lambda x: order.index(x[1]))
Python - Sort a list of dics by value of dict`s dict value	sorted(persons, key=lambda x: x['passport']['birth_info']['date'])
How can I remove the fragment identifier from a URL?	urlparse.urldefrag('http://www.address.com/something#something')
How to download to a specific directory with Python?	urllib.request.urlretrieve('http://example.com/file.ext', '/path/to/dir/filename.ext')
removing duplicates of a list of sets	list(set(frozenset(item) for item in L))
removing duplicates of a list of sets	[set(item) for item in set(frozenset(item) for item in L)]
How to terminate process from Python using pid?	p.terminate()
Delete all objects in a list	del mylist[:]
How to throw an error window in Python in Windows	ctypes.windll.user32.MessageBoxW(0, 'Error', 'Error', 0)
Remove empty strings from a list of strings	str_list = list([_f for _f in str_list if _f])
How to remove whitespace in BeautifulSoup	re.sub('[\\ \\n]{2,}', '', yourstring)
Dot notation string manipulation	re.sub('\\.[^.]+$', '', s)
Removing elements from an array that are in another array	A[np.all(np.any(A - B[:, (None)], axis=2), axis=0)]
write to csv from DataFrame python pandas	a.to_csv('test.csv', cols=['sum'])
call a Python script from another Python script	exec(compile(open('test2.py').read(), 'test2.py', 'exec'))
call a Python script from another Python script	subprocess.call('test1.py', shell=True)
How do I sort a zipped list in Python?	sorted(zipped, key=lambda x: x[1])
How do I sort a zipped list in Python?	zipped.sort(key=lambda t: t[1])
Sorting a dictionary by value then by key	sorted(list(y.items()), key=lambda x: (x[1], x[0]), reverse=True)
Using BeautifulSoup to select div blocks within HTML	soup.find_all('div', class_='crBlock ')
Remove list of indices from a list in Python	[element for i, element in enumerate(centroids) if i not in index]
Comparing two lists in Python	list(set(listA) & set(listB))
http file downloading and saving	testfile = urllib.request.URLopener()<nl>testfile.retrieve('http://randomsite.com/file.gz', 'file.gz')
http file downloading and saving	urllib.request.urlretrieve('http://randomsite.com/file.gz', 'file.gz')
http file downloading and saving	file_name = wget.download(file_url)
Accented characters in Matplotlib	ax.set_yticklabels(['\xe9', '\xe3', '\xe2'])
How to get a list of all integer points in an n-dimensional cube using python?	list(itertools.product(list(range(-x, y)), repeat=dim))
How can I convert a unicode string into string literals in Python 2.7?	print(s.encode('unicode_escape'))
python - How to format variable number of arguments into a string?	'Hello %s' % ', '.join(my_args)
Python regex search AND split	re.split('(ddd)', 'aaa bbb ccc ddd eee fff', 1)
Python regex search AND split	re.split('(d(d)d)', 'aaa bbb ccc ddd eee fff', 1)
Convert list of dictionaries to Dataframe	pd.DataFrame(d)
How to split string into words that do not contain whitespaces in python?	"""""""This is a string"""""".split()"
How to split string into words that do not contain whitespaces in python?	"""""""This<tab> is a<tab> string"""""".split()"
python pandas: apply a function with arguments to a series	my_series.apply(your_function, args=(2, 3, 4), extra_kw=1)
Python: How to remove all duplicate items from a list	woduplicates = list(set(lseperatedOrblist))
Sum of product of combinations in a list	sum([(i * j) for i, j in list(itertools.combinations(l, 2))])
Using variables in Python regular expression	re.compile('{}-\\d*'.format(user))
In Python, how do I convert all of the items in a list to floats?	[float(i) for i in lst]
How can I multiply all items in a list together with Python?	from functools import reduce<nl>reduce(lambda x, y: x * y, [1, 2, 3, 4, 5, 6])
How to write a tuple of tuples to a CSV file using Python	writer.writerow(A)
How to write a tuple of tuples to a CSV file using Python	writer.writerows(A)
python, format string	"""""""{} %s {}"""""".format('foo', 'bar')"
Replace a string in list of lists	example = [x.replace('\r\n', '') for x in example]
Python: split elements of a list	[i.partition('\t')[-1] for i in l if '\t' in i]
Splitting a string by using two substrings in Python	re.search('Test(.*)print', testStr, re.DOTALL)
python, locating and clicking a specific button with selenium	next = driver.find_element_by_css_selector('li.next>a')
Getting file size in Python?	os.stat('C:\\Python27\\Lib\\genericpath.py').st_size
how do i return a string from a regex match in python	imtag = re.match('<img.*?>', line).group(0)
How to change folder names in python?	os.rename('Joe Blow', 'Blow, Joe')
How to find overlapping matches with a regexp?	re.findall('(?=(\\w\\w))', 'hello')
express binary literals	bin(173)
express binary literals	int('01010101111', 2)
express binary literals	int('010101', 2)
express binary literals	int('0b0010101010', 2)
express binary literals	bin(21)
express binary literals	int('11111111', 2)
Delete digits in Python (Regex)	re.sub('$\\d+\\W+|\\b\\d+\\b|\\W+\\d+$', '', s)
Delete digits in Python (Regex)	re.sub('\\b\\d+\\b', '', s)
Delete digits in Python (Regex)	s = re.sub('^\\d+\\s|\\s\\d+\\s|\\s\\d+$', ' ', s)
Python Split String	s.split(':', 1)[1]
How can I split this comma-delimited string in Python?	print(s.split(','))
How can I split this comma-delimited string in Python?	mystring.split(',')
How to remove parentheses only around single words in a string	re.sub('\\((\\w+)\\)', '\\1', s)
how to open a url in python	webbrowser.open_new(url)
how to open a url in python	webbrowser.open('http://example.com')
PyQt QPushButton Background color	self.pushButton.setStyleSheet('background-color: red')
Zip and apply a list of functions over a list of values in Python	[x(y) for x, y in zip(functions, values)]
How do I modify the width of a TextCtrl in wxPython?	wx.TextCtrl(self, -1, size=(300, -1))
Displaying a grayscale Image	imshow(imageArray, cmap='Greys_r')
How can I replace all the NaN values with Zero's in a column of a pandas dataframe	df.fillna(0)
how to export a table dataframe in pyspark to csv?	df.toPandas().to_csv('mycsv.csv')
how to export a table dataframe in pyspark to csv?	df.write.csv('mycsv.csv')
Sum the second value of each tuple in a list	sum(x[1] for x in structure)
How to sum the nlargest() integers in groupby	df.groupby('STNAME')['COUNTY_POP'].agg(lambda x: x.nlargest(3).sum())
what would be the python code to add time to a specific timestamp?	datetime.strptime('21/11/06 16:30', '%d/%m/%y %H:%M')
How to properly determine current script directory in Python?	os.path.dirname(os.path.abspath(__file__))
How can I do multiple substitutions using regex in python?	re.sub('(.)', '\\1\\1', text.read(), 0, re.S)
Python convert tuple to string	""""""""""""".join(('a', 'b', 'c', 'd', 'g', 'x', 'r', 'e'))"
How to get full path of current file's directory in Python?	os.path.dirname(os.path.abspath(__file__))
variable number of digit in format string	"""""""{0:.{1}%}"""""".format(value, digits)"
Get current URL in Python	self.request.url
Print a variable selected by a random number	random_choice = random.choice(choices)
Python: Sum string lengths	length = sum(len(s) for s in strings)
Sort a list by multiple attributes?	s = sorted(s, key=lambda x: (x[1], x[2]))
Sort a list by multiple attributes?	s.sort(key=operator.itemgetter(1, 2))
How to disable query cache with mysql.connector	con.commit()
Filtering a list of strings based on contents	[k for k in lst if 'ab' in k]
How do I find the first letter of each word?	output = ''.join(item[0].upper() for item in input.split())
Get name of primary field of Django model	CustomPK._meta.pk.name
How to count the number of words in a sentence?	len(s.split())
numpy matrix vector multiplication	np.einsum('ji,i->j', a, b)
check what version of Python is running	sys.version
check what version of Python is running	sys.version_info
Format number using LaTeX notation in Python	print('\\num{{{0:.2g}}}'.format(1000000000.0))
Python initializing a list of lists	x = [[] for i in range(3)]
How to apply django/jinja2 template filters 'escape' and 'linebreaks' correctly?	{{my_variable | forceescape | linebreaks}}
Split a list of tuples into sub-lists of the same tuple field	zip(*[(1, 4), (2, 5), (3, 6)])
Split a list of tuples into sub-lists of the same tuple field	[list(group) for key, group in itertools.groupby(data, operator.itemgetter(1))]
How can I turn a string into a list in Python?	list('hello')
pandas dataframe create new columns and fill with calculated values from same df	df['A_perc'] = df['A'] / df['sum']
Getting a list of all subdirectories in the current directory	os.walk(directory)
Getting a list of all subdirectories in the current directory	[x[0] for x in os.walk(directory)]
How to filter a dictionary in Python?	{i: 'updated' for i, j in list(d.items()) if j != 'None'}
How to filter a dictionary in Python?	dict((k, 'updated') for k, v in d.items() if v is None)
How to filter a dictionary in Python?	dict((k, 'updated') for k, v in d.items() if v != 'None')
